<xs:schema attributeFormDefault="unqualified" elementFormDefault="qualified" xmlns:xs="http://www.w3.org/2001/XMLSchema">
  <xs:element name="data">
    <xs:complexType>
      <xs:sequence>
        <xs:element name="transactions">
          <xs:complexType>
            <xs:sequence>
              <xs:element name="transaction" maxOccurs="unbounded" minOccurs="0">
                <xs:complexType>
                  <xs:sequence>
                    <xs:element type="xs:string" name="date"/>
                    <xs:element type="xs:string" name="tcategory"/>
                    <xs:element type="xs:float" name="amount"/>
                    <xs:element type="xs:string" name="taccount"/>
                  </xs:sequence>
                  <xs:attribute type="xs:string" name="type" use="optional"/>
                </xs:complexType>
              </xs:element>
            </xs:sequence>
          </xs:complexType>
        </xs:element>
        <xs:element name="accounts">
          <xs:complexType>
            <xs:sequence>
              <xs:element name="account" maxOccurs="unbounded" minOccurs="0">
                <xs:complexType>
                  <xs:sequence>
                    <xs:element type="xs:string" name="name"/>
                    <xs:element type="xs:float" name="balance"/>
                    <xs:element type="xs:short" name="limit"/>
                    <xs:element type="xs:string" name="type"/>
                  </xs:sequence>
                </xs:complexType>
              </xs:element>
            </xs:sequence>
          </xs:complexType>
        </xs:element>
        <xs:element name="categories">
          <xs:complexType>
            <xs:sequence>
              <xs:element name="category" maxOccurs="unbounded" minOccurs="0">
                <xs:complexType>
                  <xs:sequence>
                    <xs:element type="xs:string" name="name"/>
                    <xs:element type="xs:short" name="budget"/>
                    <xs:element type="xs:float" name="used"/>
                  </xs:sequence>
                </xs:complexType>
              </xs:element>
            </xs:sequence>
          </xs:complexType>
        </xs:element>
      </xs:sequence>
    </xs:complexType>
  </xs:element>
</xs:schema>